"presentation title",date,time,speaker,link,keywords
"UN Smart Maps Quarterly #1",2023-08-09,16:45,"Hidenori Fujimura and Yuiseki","https://docs.google.com/presentation/d/1OwuZeywXDsbAmpsuYT3m70hp4psQag7O8nfHJZNzvrs/edit?usp=sharing","UN, Smartmaps, quarterly"
"Documentation Update",2023-08-20,03:00,"Albert Kochaphum","https://hackmd.io/@MXxudfFtSvSvSonMo4L3qQ/SyT0kFwqn#/1","documentation, UN Smartmaps"
"Smart Maps report",2024-02-14,23:00+09:00,"Hidenori Fujimura","https://hackmd.io/@smartmaps/2024-02#/","UN Open GIS Monthly"
"Smart Maps and Bazaar",2024-02-20,10:00+09:00,"Hidenori Fujimura","https://speakerdeck.com/hfu/smart-maps-and-bazaar","Tech for Peace Symposium 2024"
"実践のコミュニティとしてのUN Smart Maps Group",2024-02-20,11:00+09:00,"Yuiseki","https://speakerdeck.com/yuiseki/shi-jian-nokomiyuniteitositeno-un-smart-maps-group","Tech for Peace Symposium 2024"
